{
  "schemaVersion": "1.0.0",
  "common": {
    "figureIdentity": "canonical lowercase UUID",
    "categoryIdentity": "unique display name and unique category-slug-v1 slug",
    "acceptanceFixtureProductIdPrefix": "10000000-0000-4000-8000-",
    "protectedCorpus": "All records from data/manifest.json are read-only to the acceptance reset operation."
  },
  "sqlserver": {
    "schema": "dbo",
    "tables": {
      "Categories": [
        {
          "name": "Id",
          "type": "int",
          "maximumLength": "",
          "nullable": false
        },
        {
          "name": "Name",
          "type": "nvarchar",
          "maximumLength": "64",
          "nullable": false
        },
        {
          "name": "Slug",
          "type": "varchar",
          "maximumLength": "64",
          "nullable": false
        }
      ],
      "Figures": [
        {
          "name": "Id",
          "type": "uniqueidentifier",
          "maximumLength": "",
          "nullable": false
        },
        {
          "name": "Name",
          "type": "nvarchar",
          "maximumLength": "80",
          "nullable": false
        },
        {
          "name": "Description",
          "type": "nvarchar",
          "maximumLength": "1200",
          "nullable": false
        },
        {
          "name": "CategoryId",
          "type": "int",
          "maximumLength": "",
          "nullable": false
        },
        {
          "name": "ImageFile",
          "type": "varchar",
          "maximumLength": "40",
          "nullable": false
        },
        {
          "name": "CreatedUtc",
          "type": "datetime2",
          "maximumLength": "",
          "nullable": false
        },
        {
          "name": "LastUpdatedUtc",
          "type": "datetime2",
          "maximumLength": "",
          "nullable": false
        }
      ]
    },
    "constraints": [
      "Categories|IDENTITY:Categories.Id|IDENTITY|Id|-|-|-|-",
      "Categories|PK_Categories|PRIMARY KEY|Id|-|-|-|-",
      "Categories|UQ_Categories_Name|UNIQUE|Name|-|-|-|-",
      "Categories|UQ_Categories_Slug|UNIQUE|Slug|-|-|-|-",
      "Figures|CK_Figures_ImageFile|CHECK|-|-|-|-|([ImageFile]=lower(CONVERT([varchar](36),[Id]))+'.png')",
      "Figures|FK_Figures_Categories|FOREIGN KEY|CategoryId|dbo.Categories(Id)|NO_ACTION|NO_ACTION|-",
      "Figures|PK_Figures|PRIMARY KEY|Id|-|-|-|-"
    ],
    "indexes": [
      "Categories|PK_Categories|true|Id:asc|-",
      "Categories|UQ_Categories_Name|true|Name:asc|-",
      "Categories|UQ_Categories_Slug|true|Slug:asc|-",
      "Figures|IX_Figures_CategoryId|false|CategoryId:asc|-",
      "Figures|IX_Figures_Name|false|Name:asc|-",
      "Figures|PK_Figures|true|Id:asc|-"
    ],
    "migration": {
      "table": "__EFMigrationsHistory",
      "orderedHistory": [
        "202608180001_ContractBaseline|8.0.22"
      ]
    },
    "tls": {
      "managedRequired": true,
      "trustServerCertificateAllowed": false
    }
  },
  "postgresql": {
    "schema": "public",
    "tables": {
      "categories": [
        {
          "name": "id",
          "type": "bigint",
          "maximumLength": "",
          "nullable": false
        },
        {
          "name": "name",
          "type": "character varying",
          "maximumLength": "64",
          "nullable": false
        },
        {
          "name": "slug",
          "type": "character varying",
          "maximumLength": "64",
          "nullable": false
        }
      ],
      "figures": [
        {
          "name": "id",
          "type": "uuid",
          "maximumLength": "",
          "nullable": false
        },
        {
          "name": "name",
          "type": "character varying",
          "maximumLength": "80",
          "nullable": false
        },
        {
          "name": "description",
          "type": "character varying",
          "maximumLength": "1200",
          "nullable": false
        },
        {
          "name": "category_id",
          "type": "bigint",
          "maximumLength": "",
          "nullable": false
        },
        {
          "name": "image_file",
          "type": "character varying",
          "maximumLength": "40",
          "nullable": false
        },
        {
          "name": "created_at",
          "type": "timestamp with time zone",
          "maximumLength": "",
          "nullable": false
        },
        {
          "name": "updated_at",
          "type": "timestamp with time zone",
          "maximumLength": "",
          "nullable": false
        }
      ]
    },
    "constraints": [
      "categories|IDENTITY:categories.id|IDENTITY|id|-|-|-|-",
      "categories|categories_pkey|PRIMARY KEY|id|-|-|-|-",
      "categories|uq_categories_name|UNIQUE|name|-|-|-|-",
      "categories|uq_categories_slug|UNIQUE|slug|-|-|-|-",
      "figures|ck_figures_image_file|CHECK|-|-|-|-|((image_file)::text=((id)::text||'.png'::text))",
      "figures|figures_pkey|PRIMARY KEY|id|-|-|-|-",
      "figures|fk_figures_categories|FOREIGN KEY|category_id|public.categories(id)|NO ACTION|NO ACTION|-"
    ],
    "indexes": [
      "categories|categories_pkey|true|id:asc|-",
      "categories|uq_categories_name|true|name:asc|-",
      "categories|uq_categories_slug|true|slug:asc|-",
      "figures|figures_pkey|true|id:asc|-",
      "figures|ix_figures_category_id|false|category_id:asc|-",
      "figures|ix_figures_name|false|name:asc|-"
    ],
    "migration": {
      "table": "flyway_schema_history",
      "orderedHistory": [
        "1|contract baseline|SQL|V1__contract_baseline.sql|true"
      ]
    },
    "tls": {
      "managedRequired": true,
      "minimumProtocol": "TLSv1.2"
    }
  }
}
